{
  "$schema": "http://json-schema.org/draft-07/schema#",
  "$id": "pce/schema/v0.5",
  "title": "PCE Map Document",
  "description": "Task-scoped codebase map: one model, rendered as MAP (structure) and SEQUENCE (behavior) projections.",
  "type": "object",
  "required": ["protocol_version", "meta", "nodes", "edges", "flows"],
  "additionalProperties": false,
  "properties": {
    "protocol_version": { "enum": ["0.4", "0.5"] },

    "meta": {
      "type": "object",
      "required": ["title", "intent", "generated_at", "commit_hash", "analysis_scope"],
      "additionalProperties": false,
      "properties": {
        "title": { "type": "string" },
        "intent": {
          "enum": ["explain", "debug", "extend"],
          "description": "Calibrates what the agent generates and the viewer's default view. explain: canonical flows, no repro runs, no diff. debug: pathological flow front and center. extend: current state + proposed diff + hotspot advisory."
        },
        "task": { "type": "string", "description": "Free-form task statement (bug id, feature request, onboarding question)." },
        "repo": { "type": "string" },
        "generated_at": { "type": "string", "format": "date-time" },
        "commit_hash": { "type": "string", "description": "HEAD at generation time. Maps are EPHEMERAL: valid for this commit, not maintained afterwards." },
        "analysis_scope": {
          "type": "string",
          "description": "Human-readable definition of what is 'in focus'. The perimeter-closure invariant applies within this scope."
        },
        "scan_coverage": {
          "type": "object",
          "description": "Honest declaration of residual uncertainty (unknown unknowns line of defense).",
          "properties": {
            "scanned_sources": { "type": "array", "items": { "type": "string" }, "description": "e.g. ['migrations', 'spring annotations', 'rmq bindings config', 'git history 6mo', 'environment manifest']" },
            "not_scanned": { "type": "array", "items": { "type": "string" }, "description": "e.g. ['manual prod changes', 'external systems without code in repo']" }
          }
        },
        "environment_manifest_ref": { "type": "string", "description": "Path/URL of the manifest consumed during generation, if any." },
        "preset": { "type": "string", "description": "Altitude preset this map was generated under (e.g. 'overview'). Absent = canonical full-detail map. Rules: agent-contract.md §11 + presets/<preset>.md." },
        "derived_from": { "type": "string", "description": "For preset projections: absolute path (forward slashes) of the canonical map this document was derived from. Projections are regenerated map-to-map, never analyzed from code directly." },
        "source_root": { "type": "string", "description": "Absolute path to the analyzed repo on the machine running the viewer. When present, the viewer resolves node.source_refs (file:lineStart-lineEnd, repo-relative) to live code: previews the slice in the inspector and offers 'Open in IDE' (code -g). Omit to fall back to embedded code_snippets only." },
        "case_rounds": {
          "type": "array",
          "description": "bug-detective investigation rounds, in order",
          "items": {
            "type": "object",
            "required": ["round", "action", "outcome"],
            "properties": {
              "round": { "type": "integer" },
              "action": { "type": "string" },
              "outcome": { "type": "string" }
            },
            "additionalProperties": false
          }
        },
        "case_rounds_max": { "type": "integer", "description": "budget: max rounds before interim dossier" }
      }
    },

    "nodes": {
      "type": "array",
      "items": { "$ref": "#/definitions/node" }
    },

    "edges": {
      "type": "array",
      "items": { "$ref": "#/definitions/edge" }
    },

    "expanded_children": {
      "type": "object",
      "description": "Lazily generated internals per parent node id. Structure MUST come from the code index (deterministic); LLM adds summaries only.",
      "additionalProperties": {
        "type": "object",
        "required": ["nodes", "edges", "port_map"],
        "properties": {
          "frame": { "$ref": "#/definitions/rect" },
          "port_map": {
            "type": "object",
            "description": "external edge id -> internal node id(s). MANDATORY: forces the agent to actually resolve where each external edge attaches. One external edge MAY map to multiple internal ports.",
            "additionalProperties": {
              "oneOf": [
                { "type": "string" },
                { "type": "array", "items": { "type": "string" } }
              ]
            }
          },
          "nodes": { "type": "array", "items": { "$ref": "#/definitions/node" } },
          "edges": { "type": "array", "items": { "$ref": "#/definitions/edge" } }
        }
      }
    },

    "flows": {
      "type": "array",
      "items": { "$ref": "#/definitions/flow" }
    },

    "diffs": {
      "type": "array",
      "description": "Proposed STRUCTURAL changes (impact-diff skill output).",
      "items": { "$ref": "#/definitions/diffOp" }
    },

    "flow_diffs": {
      "type": "array",
      "description": "Proposed BEHAVIORAL changes: how flows transform under the proposed diff. Rendered as ghost/added arrows in SEQUENCE.",
      "items": {
        "type": "object",
        "required": ["flow_id"],
        "properties": {
          "flow_id": { "type": "string" },
          "removed_step_seqs": { "type": "array", "items": { "type": "integer" }, "description": "Steps that disappear under the proposed change." },
          "added_steps": { "type": "array", "items": { "$ref": "#/definitions/step" } },
          "note": { "type": "string" }
        }
      }
    },

    "advisory": {
      "type": "object",
      "description": "LLM-written interpretation layer ON TOP of deterministic metrics. Never the other way around.",
      "properties": {
        "summary": { "type": "string" },
        "hotspots": {
          "type": "array",
          "description": "God-node / blast-radius warnings. Selection is DETERMINISTIC (spec/lint.mjs::hotspotEligible over tangle_score); the LLM only writes the recommendation. Lint rejects hotspots outside the eligible set.",
          "items": {
            "type": "object",
            "required": ["node", "recommendation"],
            "properties": {
              "node": { "type": "string" },
              "recommendation": { "type": "string", "description": "e.g. 'refactor before fixing: extract retry policy; otherwise regression risk in flows X, Y, Z'" },
              "supporting_metrics": { "type": "array", "items": { "type": "string" } }
            }
          }
        },
        "notes": {
          "type": "array",
          "description": "Non-structural observations that are NOT hotspots: runtime/perf bottlenecks, logic-density, operational risks. Honest home for insight that doesn't predict breakage radius.",
          "items": {
            "type": "object",
            "required": ["node", "kind", "note"],
            "properties": {
              "node": { "type": "string" },
              "kind": { "enum": ["perf", "logic", "risk"] },
              "note": { "type": "string" },
              "code_ref": { "type": "string" }
            }
          }
        },
        "residual_uncertainty": { "type": "string", "description": "Explicit statement of what remains unknown after this analysis." }
      }
    },

    "code_snippets": {
      "type": "object",
      "description": "Optional pre-resolved snippets for source_refs (viewer may also read files live).",
      "additionalProperties": {
        "type": "object",
        "required": ["text"],
        "properties": {
          "text": { "type": "string" },
          "hl": { "type": "array", "items": { "type": "integer" } }
        }
      }
    },

    "tours": {
      "type": "array",
      "description": "Guided walkthroughs: ordered, map-anchored explanation steps",
      "items": {
        "type": "object",
        "required": ["id", "title", "steps"],
        "additionalProperties": false,
        "properties": {
          "id": { "type": "string" },
          "title": { "type": "string" },
          "steps": {
            "type": "array",
            "minItems": 1,
            "items": {
              "type": "object",
              "required": ["seq", "focus", "md"],
              "additionalProperties": false,
              "properties": {
                "seq": { "type": "integer" },
                "focus": { "type": "array", "items": { "type": "string" }, "description": "node and/or edge ids highlighted at this step" },
                "md": { "type": "string", "description": "one paragraph, rendered as markdown in the viewer side panel" },
                "flow_ref": { "type": "string", "description": "optional flow id to auto-play at this step" }
              }
            }
          }
        }
      }
    }
  },

  "definitions": {
    "rect": {
      "type": "object",
      "required": ["x", "y", "w", "h"],
      "properties": { "x": {"type":"number"}, "y": {"type":"number"}, "w": {"type":"number"}, "h": {"type":"number"} }
    },

    "node": {
      "type": "object",
      "required": ["id", "display_id", "kind", "label", "resolution", "scope"],
      "additionalProperties": false,
      "properties": {
        "id": { "type": "string", "description": "Stable semantic id (svc_order). Used in cross-references." },
        "display_id": { "type": "string", "description": "Short human/AI shared coordinate (N2, N2.1, BB1). Rendered semi-transparent in UI; used in chat: 'explain E3', 'investigate BB1'." },
        "kind": {
          "type": "string",
          "description": "WHAT it is. Open set; common: controller, service, gateway, repo, queue, consumer, internal, db_trigger, scheduled_job, config, external_system. NOTE: black box is NOT a kind — it is resolution=suspected.",
          "minLength": 1
        },
        "label": { "type": "string" },
        "resolution": {
          "enum": ["confirmed", "suspected", "dismissed"],
          "description": "HOW MUCH we know. suspected = Black Box: cheap broad-scan found a concrete artifact hint, deep-dive not yet done. dismissed nodes are KEPT (with dismissal reason in evidence) so investigations aren't repeated."
        },
        "scope": {
          "enum": ["in_focus", "peripheral"],
          "description": "Relation to meta.analysis_scope, NOT an intrinsic property. peripheral = lives its own life and influences the focused subsystem from the side (trigger, cron, other service via shared DB)."
        },
        "summary": { "type": "string" },
        "evidence": {
          "type": "string",
          "description": "MANDATORY for resolution=suspected|dismissed. Concrete artifact that justified the suspicion (migration line, @Scheduled annotation, rmq binding, git change-coupling stat) or the dismissal reason. A black box without evidence is spam and violates the agent contract."
        },
        "relevance": { "enum": ["high", "medium", "low"], "description": "For suspected nodes: how likely to matter for the current task." },
        "source_refs": { "type": "array", "items": { "type": "string" }, "description": "file:lineStart-lineEnd. Every claim on the diagram must be one click away from real code." },
        "manifest_ref": { "type": "string", "description": "If the node came from the environment manifest rather than code scan." },
        "metrics": {
          "type": "object",
          "description": "DETERMINISTIC numbers from code index + git. No LLM involvement — otherwise the heat overlay can't be trusted.",
          "properties": {
            "fan_in": { "type": "integer" },
            "fan_out": { "type": "integer" },
            "flows_count": { "type": "integer", "description": "In how many known flows this node participates." },
            "change_coupling": { "type": "number", "description": "0..1: share of commits where this file changes together with statically-unrelated files." },
            "tangle_score": { "type": "number", "description": "0..1 composite; formula documented in agent-contract.md." }
          }
        },
        "pos": { "type": "object", "properties": { "x": {"type":"number"}, "y": {"type":"number"} }, "description": "OPTIONAL layout hint. If omitted, the viewer assigns a position via built-in left→right layered auto-layout. Provide pos only to pin a node; mixing pinned and auto nodes is allowed but auto nodes are placed on a grid and may sit near pinned ones." },
        "expandable": { "type": "boolean" },
        "investigated_at": { "type": "string", "format": "date-time", "description": "Reserved for future map accumulation. Optional in v0.4." }
      }
    },

    "edge": {
      "type": "object",
      "required": ["id", "display_id", "from", "to", "kind"],
      "additionalProperties": false,
      "properties": {
        "id": { "type": "string" },
        "display_id": { "type": "string" },
        "from": { "type": "string" },
        "to": { "type": "string" },
        "kind": {
          "enum": ["sync_call", "async_msg", "data_dep", "suspected_influence", "evidenced_by", "refuted_by"],
          "description": "suspected_influence: dashed '?' edge from/to a black box. On confirmation becomes a real kind; on dismissal disappears with the box. evidenced_by/refuted_by: epistemic edges from an evidence artifact or code node to a hypothesis node — excluded from metrics like suspected_influence."
        },
        "label": { "type": "string" },
        "evidence": { "type": "string", "description": "Required when kind=suspected_influence." }
      }
    },

    "flow": {
      "type": "object",
      "required": ["id", "title", "kind", "participants", "steps"],
      "additionalProperties": false,
      "properties": {
        "id": { "type": "string" },
        "title": { "type": "string" },
        "kind": {
          "enum": ["happy_path", "failure_path", "bug_path", "edge_case", "proposed"],
          "description": "happy_path: canonical success. failure_path: DESIGNED failure handling — the system behaving as intended under a fault (use for explain-intent failure scenarios). bug_path: reproduction of an ACTUAL defect (debug intent only — implies 'this is broken now'). edge_case: unusual-but-valid input/state. proposed: flow under a proposed diff."
        },
        "description": { "type": "string" },
        "participants": { "type": "array", "items": { "type": "string" }, "description": "Ordered lifelines for SEQUENCE." },
        "entry": { "type": "string" },
        "verified_by": {
          "enum": ["static_analysis", "local_run", "static_and_run", "hypothesis"],
          "description": "Honesty marker: was this flow confirmed by an actual run/trace or is it derived/hypothesized?"
        },
        "preface": {
          "type": "array",
          "items": { "$ref": "#/definitions/arrow" },
          "description": "Context arrows before step 1 ('how we got here') so mid-process flows don't float."
        },
        "steps": { "type": "array", "items": { "$ref": "#/definitions/step" } }
      }
    },

    "step": {
      "type": "object",
      "required": ["seq", "explanation", "arrows"],
      "additionalProperties": false,
      "properties": {
        "seq": { "type": "integer" },
        "explanation": { "type": "string", "description": "What happens and WHY it matters; shown in playback." },
        "code_ref": { "type": "string" },
        "arrows": { "type": "array", "minItems": 1, "items": { "$ref": "#/definitions/arrow" } }
      }
    },

    "arrow": {
      "type": "object",
      "required": ["from", "to", "type"],
      "additionalProperties": false,
      "description": "Atomic behavioral event. MAP derives which edges to light (arrow.edge); SEQUENCE derives activation bars by stack simulation (push on call, pop on return). The call stack is COMPUTED from data, never hand-drawn.",
      "properties": {
        "from": { "type": "string" },
        "to": { "type": "string" },
        "type": { "enum": ["call", "return", "async"] },
        "label": { "type": "string" },
        "edge": { "type": "string", "description": "Which structural edge this event travels over. Links the two projections." },
        "err": { "type": "boolean", "description": "return carrying an exception rather than a result." }
      }
    },

    "diffOp": {
      "type": "object",
      "required": ["op", "rationale"],
      "properties": {
        "op": { "enum": ["add_node", "add_edge", "modify_node", "modify_edge", "remove_node", "remove_edge"] },
        "node": { "$ref": "#/definitions/node" },
        "edge": { "$ref": "#/definitions/edge" },
        "target": { "type": "string", "description": "id for modify_*/remove_* ops." },
        "rationale": { "type": "string" }
      }
    }
  }
}
