{
  "protocol_version": "0.5",
  "meta": {"title": "Particle FX demo map", "intent": "explain", "commit_hash": "deadbeefcafe", "generated_at": "2026-07-08T12:00:00Z", "analysis_scope": "Order processing flow"},
  "nodes": [
    {"id": "n_api", "display_id": "N1", "kind": "controller", "label": "API Controller", "resolution": "confirmed", "scope": "in_focus", "summary": "Entry point", "source_refs": [], "expandable": false},
    {"id": "n_svc", "display_id": "N2", "kind": "service", "label": "Order Service", "resolution": "confirmed", "scope": "in_focus", "summary": "Business logic", "source_refs": [], "expandable": false, "metrics": {"fan_in": 1, "fan_out": 2}},
    {"id": "n_repo", "display_id": "N3", "kind": "repo", "label": "Order Repository", "resolution": "confirmed", "scope": "in_focus", "summary": "Persistence", "source_refs": [], "expandable": false},
    {"id": "n_q", "display_id": "N4", "kind": "queue", "label": "Events Queue", "resolution": "confirmed", "scope": "in_focus", "summary": "Async fan-out", "source_refs": [], "expandable": false}
  ],
  "edges": [
    {"id": "e1", "display_id": "E1", "from": "n_api", "to": "n_svc", "kind": "sync_call", "label": "place order"},
    {"id": "e2", "display_id": "E2", "from": "n_svc", "to": "n_repo", "kind": "sync_call", "label": "save"},
    {"id": "e3", "display_id": "E3", "from": "n_svc", "to": "n_q", "kind": "async_msg", "label": "emit event"}
  ],
  "flows": [
    {"id": "f1", "title": "Place order (happy path)", "kind": "happy_path", "description": "Client places an order.", "participants": ["n_api", "n_svc", "n_repo", "n_q"],
     "steps": [
       {"seq": 1, "explanation": "Controller receives request", "arrows": [{"type": "call", "from": "n_api", "to": "n_svc", "edge": "e1", "label": "place order"}]},
       {"seq": 2, "explanation": "Service persists order", "arrows": [{"type": "call", "from": "n_svc", "to": "n_repo", "edge": "e2", "label": "save"}]},
       {"seq": 3, "explanation": "Service emits event", "arrows": [{"type": "async", "from": "n_svc", "to": "n_q", "edge": "e3", "label": "emit"}]}
     ]}
  ],
  "tours": [
    {"id": "t1", "title": "How an order gets placed", "steps": [
      {"seq": 1, "focus": ["n_api", "e1"], "md": "The **API Controller** receives the incoming request and calls the `Order Service` via `E1`."},
      {"seq": 2, "focus": ["n_svc", "n_repo", "e2"], "md": "The `Order Service` persists the order through the **Order Repository** (`E2`)."},
      {"seq": 3, "focus": ["n_svc", "n_q", "e3"], "md": "Finally the service emits an event onto the `Events Queue` — see the full call sequence in the linked flow.", "flow_ref": "f1"}
    ]}
  ]
}
