{
  "protocol_version": "0.5",
  "meta": {
    "title": "Double-charge investigation",
    "intent": "debug",
    "task": "Investigate duplicate payment charge on order #4471",
    "generated_at": "2026-07-15T10:00:00Z",
    "commit_hash": "6b9d415a1b2c3d4e",
    "analysis_scope": "Payment charge + retry path (src/payment/)",
    "case_rounds": [
      {
        "round": 1,
        "action": "read code: retry wrapper + charge() implementation",
        "outcome": "suspected race condition (H1 open); no idempotency key found"
      },
      {
        "round": 2,
        "action": "pulled webhook + payment provider logs for order #4471",
        "outcome": "dismissed duplicate-webhook theory (H2); confirmed missing idempotency check as root cause (H3)"
      }
    ],
    "case_rounds_max": 3
  },
  "nodes": [
    {
      "id": "n_retry",
      "display_id": "N1",
      "kind": "service",
      "label": "Retry Wrapper",
      "resolution": "confirmed",
      "scope": "in_focus",
      "summary": "Wraps charge() calls with retry-on-timeout logic.",
      "source_refs": ["src/payment/retry.js:1-40"]
    },
    {
      "id": "n_charge",
      "display_id": "N2",
      "kind": "function",
      "label": "charge()",
      "resolution": "confirmed",
      "scope": "in_focus",
      "summary": "Executes a payment charge against the provider.",
      "source_refs": ["src/payment/charge.js:1-60"]
    },
    {
      "id": "h_race",
      "display_id": "H1",
      "kind": "hypothesis",
      "label": "Race condition in payment retry",
      "resolution": "suspected",
      "scope": "in_focus",
      "summary": "incidence: unverified — static shape only",
      "evidence": "retry() wraps charge() without an idempotency key — src/payment/retry.js:18-24; needs a concurrency repro to confirm shape/incidence split."
    },
    {
      "id": "h_webhook",
      "display_id": "H2",
      "kind": "hypothesis",
      "label": "Duplicate webhook delivery",
      "resolution": "dismissed",
      "scope": "in_focus",
      "summary": "Webhook provider dedupe key observed present in logs; single actual delivery confirmed for order #4471.",
      "evidence": "dismissed: webhook logs show a dedupe-key header on both attempts, provider confirms only one actual delivery (ops log, 2026-07-14)."
    },
    {
      "id": "h_missing_check",
      "display_id": "H3",
      "kind": "hypothesis",
      "label": "Missing idempotency check in charge()",
      "resolution": "confirmed",
      "scope": "in_focus",
      "summary": "shape: confirmed — src/payment/charge.js:42\nincidence: observed duplicate POST /payments/charge in prod log at 2026-07-14T10:02:03Z (order #4471, two charge.js:42 calls 340ms apart)",
      "evidence": "prod log: two charge.js:42 invocations for order #4471, 340ms apart, both returning success."
    }
  ],
  "edges": [
    {
      "id": "e1",
      "display_id": "E1",
      "from": "n_retry",
      "to": "n_charge",
      "kind": "sync_call",
      "label": "charge()"
    },
    {
      "id": "e2",
      "display_id": "E2",
      "from": "n_retry",
      "to": "h_race",
      "kind": "evidenced_by",
      "label": "no idempotency key found",
      "evidence": "retry.js:18-24 calls charge() with no dedupe/idempotency key"
    },
    {
      "id": "e3",
      "display_id": "E3",
      "from": "n_charge",
      "to": "h_missing_check",
      "kind": "evidenced_by",
      "label": "missing check at charge.js:42",
      "evidence": "charge.js:42 — no idempotency guard before provider call"
    },
    {
      "id": "e4",
      "display_id": "E4",
      "from": "n_retry",
      "to": "h_webhook",
      "kind": "refuted_by",
      "label": "webhook dedupe key confirmed single delivery",
      "evidence": "webhook logs: dedupe-key header present, provider confirms one delivery"
    }
  ],
  "flows": [
    {
      "id": "f1",
      "title": "Double charge under retry race (reproduction)",
      "kind": "bug_path",
      "description": "Retry wrapper re-invokes charge() before the first attempt returns; with no idempotency key both attempts succeed and the customer is charged twice.",
      "participants": ["n_retry", "n_charge"],
      "verified_by": "static_analysis",
      "steps": [
        {
          "seq": 1,
          "explanation": "First attempt calls charge()",
          "arrows": [
            {"type": "call", "from": "n_retry", "to": "n_charge", "edge": "e1", "label": "charge() attempt 1"}
          ]
        },
        {
          "seq": 2,
          "explanation": "Timeout fires before attempt 1 returns; retry logic calls charge() again — no idempotency key means the second call is not deduped",
          "arrows": [
            {"type": "call", "from": "n_retry", "to": "n_charge", "edge": "e1", "label": "charge() attempt 2 (race)"}
          ]
        },
        {
          "seq": 3,
          "explanation": "Both attempts complete successfully — the customer is charged twice for order #4471",
          "arrows": [
            {"type": "return", "from": "n_charge", "to": "n_retry", "edge": "e1", "label": "success (attempt 2)"},
            {"type": "return", "from": "n_charge", "to": "n_retry", "edge": "e1", "label": "success (attempt 1)"}
          ]
        }
      ]
    }
  ],
  "tours": [
    {
      "id": "t1",
      "title": "Case verdict: double-charge root cause",
      "steps": [
        {
          "seq": 1,
          "focus": ["h_race", "e2"],
          "md": "Round 1 suspected a **race condition** in the retry wrapper — the code lacked an idempotency key (*incidence: unverified — static shape only*)."
        },
        {
          "seq": 2,
          "focus": ["h_webhook", "e4"],
          "md": "Round 2 checked webhook delivery logs and **dismissed** the duplicate-webhook theory: the provider's dedupe key confirmed only one actual delivery."
        },
        {
          "seq": 3,
          "focus": ["h_missing_check", "n_charge", "e3"],
          "md": "**Confirmed**: `charge()` at `src/payment/charge.js:42` has no idempotency check. Production logs show two charge attempts 340ms apart for order #4471.",
          "flow_ref": "f1"
        }
      ]
    }
  ]
}
